reviewer_name,review date,review text,review_polarity
Robert Daniels,"Aug 26, 2020","Sprawling and ambitious, flawed yet admirable, failure and success concurrently reside in every minute of Tenet. A technical feat but a narrative dud.",fresh
Alistair Harkness,"Aug 26, 2020","[W]hat's surprising about the film is how attuned to the current moment it sometimes feels, not just in its futuristic prognostications, but in its grimly ironic thematic obsession with humanity's unwillingness to prepare for a future it can see coming.",fresh
Roe McDermott,"Aug 26, 2020","The performances are all excellent, with Debicki elevating Nolan's rote depiction of abusive relationships and motherhood, and Pattinson providing louche charm galore, while Washington is an endlessly compelling presence...",fresh
Jennifer Heaton,"Aug 26, 2020","Tenet is a unique and often stunning film about the nature of time and fate, but it's ultimately a little too smart for its own good.",fresh
Brian Tallerico,"Aug 26, 2020","It is 100% designed as an experience for people who have unpacked films like The Prestige and Memento late into the night, hoping to give Nolan fans more to chew on than ever before.",fresh
Caspar Salmon,"Aug 26, 2020","""Tenet"" is, as breathless as it can feel in its best bits, ultimately, no more and no less than a consummately arranged film about a group of people who arrive, get the job done with enormous skill and at great expense, and leave.",fresh
Amber Wilkinson,"Aug 26, 2020","whether you ultimately like the end result or not, you'll definitely feel something, even if it's only the booming bass of Richard King's sound design and Ludwig Göransson's score rattling your seat at key moments.",fresh
Andrea G. Bermejo,"Aug 26, 2020","Tenet's first hour is as elegant as its director, always in a suit. [Full review in Spanish]",fresh
Alex Hudson,"Aug 26, 2020",Nolan's latest contribution to the canon of first-year dorm posters was made for stoned teens who want to get their mind blown by trippy fight sequences and unsolvable paradoxes about time travel.,fresh
Chris Knight,"Aug 26, 2020","You could take the advice Poésy's character gives... ""Don't try to understand it. Feel it.""",fresh
Chris Bumbray,"Aug 26, 2020","Incredibly ambitious and inventive, Tenet is a film that demands repeat viewings. To boil it down - imagine a super cerebral version of a James Bond movie - but backwards.",fresh
Andrew Parker,"Aug 26, 2020","It's not the best Nolan film by a longshot, but it's certainly the most Nolan film, and there's certainly a curious charm to that.",fresh
Nicola Austin,"Aug 25, 2020","The most audacious Nolan film to date; Tenet is pure cinematic spectacle. The score, mind-bending concept & utterly immersive action make for a truly unique experience,",fresh
Luis Martínez,"Aug 25, 2020",Christopher Nolan turns the spy thriller into a disproportionate palindromic spectacle that recovers the pleasure of perplexity in cinema. [Full Review in Spanish],fresh
Manu Yáñez,"Aug 25, 2020","On the surface, the strokes in Tenet may seem simple, but they have grand effects especially as far as its cinematography is concerned. [Full Review in Spanish]",fresh
Christina Newland,"Aug 25, 2020",Tenet is a locked puzzle box with nothing inside.,rotten
David Stratton,"Aug 25, 2020",Maybe it will take repeated viewings to fully appreciate Nolan's achievement here; certainly he deserves praise for his attempts to reinvent a pretty tired genre.,fresh
Alison Rowat,"Aug 25, 2020","This is Nolan on typically spectacular form... All terrific, but then we come to the story. A riddle wrapped in a mystery inside an enigma is just the start of it.",fresh
Robert Salusbury,"Aug 25, 2020","In its finest moments, Tenet is like Pattinson's hair: slick and immaculate. But messy plotting and deliberately confused dialogue drive the film frustratingly off-course time and time again, leaving us with Nolan's patchiest work to date.",fresh
Peter Bradshaw,"Aug 25, 2020","A deadpan jeu d'esprit, a cerebral cadenza, a deadpan flourish of crazy implausibility - but supercharged with steroidal energy and imagination.",fresh
Nicholas Fonseca,"Aug 25, 2020","Tenet cuts both ways, welcoming us into Nolan's time-bending world of wonder while also practically daring us to come out the other end without a headache.",fresh
Jim Slotek,"Aug 25, 2020",Nolan has taken a trope that has sent many a movie down a rabbit hole - time travel - and found a way to make it even more confounding.,fresh
Amon Warmann,"Aug 25, 2020","It's peak Nolan, in a good way, and even if some characters are not as fleshed out, his cast convincingly sells the impact of what's happening at any given moment.",fresh
Zehra Phelan,"Aug 25, 2020","Christopher Nolan's mind-bending melting pot of confusion is a visually epic phenomena, but its vagueness and headache-inducing storyline leave a sour taste.",rotten
George Simpson,"Aug 25, 2020","Tenet's twists and thoughtful complexities will have the most-devoted Nolan fans heading back to the cinema for a rewatch, to catch whatever they missed the first time around.",fresh
Michael Bond,"Aug 25, 2020","While my brain wrestled with 'temporal pincer movements' and a double helping of high-speed car-chases, what keeps you going is Nolan's obvious sincerity, his love of real cinematic spectacle and his tremendous talent for staging it.",fresh
Kate Muir,"Aug 25, 2020",Christopher Nolan's spy thriller Tenet is a mind-boggling and time-bending spectacle.,fresh
Alex Lines,"Aug 25, 2020","Tenet is not a complete disaster, nor is it the messianic blockbuster that will help pull cinemas out of the rubble this year.",fresh
Peter Howell,"Aug 25, 2020",Christopher Nolan's most challenging film - and also his most satisfying.,fresh
Will Gompertz,"Aug 25, 2020","It won't leave you shaken, but your mind will be stirred. And that has to be worth a trip to the cinema.",fresh
Víctor López G.,"Aug 24, 2020","An incredible time at the movies for which - and this may sound like an exaggeration, but from my own experience it is not - not all brains are prepared... [Full Review in Spanish]",fresh
Alejandro G. Calvo,"Aug 24, 2020","Tenet is a crazy, revolutionary, extraordinary and chilling maze where Christopher Nolan seems to have reached the limit. [Full Review in Spanish]",fresh
Graeme Tuckett,"Aug 24, 2020","Tenet is a massively conceived and structured film, but it lacks a heart.",rotten
Vicky Roach,"Aug 24, 2020",Christopher Nolan has pulled out all the stops for Tenet.,fresh
Hanna Flint,"Aug 24, 2020","Luckily, for what Tenet lacks in narrative comprehension, it more than makes up for in action--a cinematic language with which Nolan has become increasingly fluent.",fresh
Mark Goodyear,"Aug 24, 2020",Tenet is Nolan's ultimate puzzle. Those with the constitution to unwaveringly pay attention to its secrets will be rewarded with an epic tale found somewhere beyond time. Those without may just have to get by on the visual achievements alone,fresh
Tom Shone,"Aug 24, 2020","In short, Tenet isn't any old Christopher Nolan movie. It's a Christopher Nolan movie squared - Nolan to the power of Nolan.",fresh
Simran Hans,"Aug 23, 2020","Nolan seems to be... encouraging the audience to trust the film's beats and to feel its impact on a gut level. As a strategy of film-making, it's a supremely confident one and in parts Nolan pulls it off.",fresh
Emma Simmonds,"Aug 22, 2020","Although shaky in its communication of the science, it more than makes up for it in ambition and stupendous action.",fresh
Doug Jamieson,"Aug 22, 2020","It's easy to be dazzled by its visual feats, but it's hard to truly enjoy a film that leaves its audience feeling entirely befuddled and exhausted by everything they've just experienced.",fresh
Chris Hunneysett,"Aug 22, 2020","bold, epic and ingenious",fresh
Tero Heikkinen,"Aug 22, 2020","Washington in the lead is perfect and as we already saw in Spike Lee's BlacKkKlansman, he can carry a film on his shoulders. In Tenet this is even more evident.",fresh
Andrew F. Peirce,"Aug 22, 2020","Tenet instead feels like it's pushing you away from engaging with its deeper plot, rather than inviting you in to engage with it intimately.",rotten
Anthony O'Connor,"Aug 22, 2020","Overlong, noisy, full of poe-faced delivery of portentous dialogue, needlessly convoluted plot threads, unearned sense of gravitas that verges on the unintentionally hilarious and a script that isn't even vaguely as clever as it seems to think it is",rotten
Wenlei Ma,"Aug 22, 2020","If Tenet had paid as much attention to its writing and character work as it did to its visual and conceptual ambitions, it could have been a masterpiece instead of merely great. But it's still great.",fresh
Philip De Semlyen,"Aug 21, 2020","After five months stuck in front of the small screen, maybe being a little overwhelmed is no bad thing. But it's hard to escape the sense that less might have been more.",rotten
Peter Gray,"Aug 21, 2020","It's breathtaking at times, and frustrating at others, but even with all its near-detrimental ambition it's a film that is at least trying to break a familiar mould.",fresh
Jamie East,"Aug 21, 2020","It's a tense, bewildering assault on the senses. It was never going to live up to all the expectations - but despite the frayed plot and bad script, this is still a film you need to see.",fresh
Alan Corr,"Aug 21, 2020",It's a high concept thriller which never fails to take itself with deadly seriousness but Tenet fails to live up to the intriguing set-up in the first act and doesn't quite convince the viewer of its internal logic...,rotten
Sandra Hall,"Aug 21, 2020","No doubt avid students of the Nolan formula will get months of entertainment out of repeated viewings, but for me it was oddly tantalizing -- full of good things but ultimately frustrating.",fresh
Emily Zemler,"Aug 21, 2020","Nolan is the sort of filmmaker who captures our imaginations for what could be possible, which is something that feels important right now.",fresh
Tom Beasley,"Aug 21, 2020","If a headache can ever be pleasurable, it's when watching Tenet.",fresh
Danny Leigh,"Aug 21, 2020","Great movies always time travel - living with you beyond the closing credits, carried into the future. With Tenet, 150 minutes pass harmlessly, but the film left my head before I took off my face mask.",fresh
Adam Woodward,"Aug 21, 2020","If Nolan has out-Nolaned himself, it's in the action set-pieces which, despite being of head-scrambling technical intricacy, are sharper than Occam's razor and carried off with astonishing economy.",fresh
Scott Davis,"Aug 21, 2020",Nolan is an artist extraordinaire.,fresh
Rosie Fletcher,"Aug 21, 2020","The most important film of the year is a heavy weight to carry, and Tenet for the most part pulls it off. This may not be a perfect film but it could just be perfect cinema.",fresh
Leslie Felperin,"Aug 21, 2020","Altogether, it makes for a chilly, cerebral film - easy to admire, especially since it's so rich in audacity and originality, but almost impossible to love, lacking as it is in a certain humanity.",rotten
Charlotte O'Sullivan,"Aug 21, 2020","To point out that Tenet has flaws feels ungrateful. It's like slagging off Santa. But, I confess, some of the yick yacking - vis a vis physics, metaphysics and so on - made me sleepy... Those quibbles aside, Tenet is an eye-popping, ground-breaking blast.",fresh
Barry Hertz,"Aug 21, 2020","We're never meant to know what exactly is going on at any one moment, but we will be - we must be - entertained by the overwhelming nonsense of it all.",fresh
Kevin Maher,"Aug 21, 2020","The real joy of the film, nonetheless, is the sheer spectacle.",fresh
Radheyan Simonpillai,"Aug 21, 2020",The movie is a race against a clock that defies everything we know about time. Massively scaled sequences have time moving forward and backwards and zigzagging all at once. The action exceeds anything Nolan has ever done before.,fresh
Linda Marric,"Aug 21, 2020","Revisiting ideas he had already broached in his brilliantly underrated space saga Interstellar, Nolan is back again to his favourite subject, Time. The results are, unsurprisingly, phenomenal.",fresh
Jessica Kiang,"Aug 21, 2020","Seek it out, if only to marvel at the entertainingly inane glory of what we once had and are in danger of never having again.",fresh
Matt Purslow,"Aug 21, 2020","Tenet feels a little conservative, as if Nolan's style is a franchise rather than a framework. Despite this, it remains more interesting than most other tentpole movies and acts as a beacon for the director's strengths.",fresh
Fionnuala Halligan,"Aug 21, 2020","It's a dream ride... for the most part, for anyone looking for glitzy escapism, and who wouldn't include themselves in that demographic right now.",fresh
Jonathan Romney,"Aug 21, 2020","Nolan's latest may well be full of sound and fury, signifying nothing, or it may signify something imponderably resonant, and signify it forward, backward and inside out. Does your head hurt yet?",fresh
Shannon Connellan,"Aug 21, 2020","It's the kind of film worthy of heralding a triumphant, unashamedly explosive return to cinemas, whenever that happens.",fresh
Andy Lea,"Aug 21, 2020","Bamboozling, bold, wildly spectacular - this could be the perfect curtain-raiser for this year's delayed blockbuster season.",fresh
Catherine Shoard,"Aug 21, 2020",The world is more than ready for a fabulous blockbuster... It's a real shame Tenet isn't it.,rotten
Mike McCahill,"Aug 21, 2020","What's really there to untangle, beyond loops of string and a whole lot of smoke rings?",rotten
Brian Lloyd,"Aug 21, 2020","When you come right down to it, 'Tenet' is a mess. A gloriously shot, exquisitely staged mess with a thrilling final act - but still a mess.",rotten
Simon Miraudo,"Aug 21, 2020","For those who don't want to engage with Nolan's academic exercises, just tune out and revel in its baser pleasures: thrilling spy set pieces and charismatic leads. The other stuff? Ain't nobody got time for that.",fresh
Nicholas Barber,"Aug 21, 2020","In the end, ""Tenet"" isn't one of Nolan's most satisfying films. But after I've seen it four or five more times, maybe I'll change my mind.",fresh
James Mottram,"Aug 21, 2020","Happily, Tenet exceeds our already sky-high expectations.",fresh
Clarisse Loughrey,"Aug 21, 2020",Tenet is a thrilling place to get lost in.,fresh
Jordan Farley,"Aug 21, 2020","The stakes have never been higher, but Tenet is exactly the film cinemas need right now.",fresh
Donald Clarke,"Aug 21, 2020","Even if we were brave enough to try, we would not be capable of spoiling a plot so wilfully obtuse it demands repeat viewings to disentangle.",fresh
Laura Potier,"Aug 21, 2020","Tenet is technically excellent and challenging, pushing boundaries and subverting expectations with the director's usual elegance.",fresh
Guy Lodge,"Aug 21, 2020","A concrete cornucopia of global chaos and threat, in which humanity's survival depends on the minor matter of reshaping time and space, ""Tenet"" looks well suited to an anxious age.",fresh
Alex Godfrey,"Aug 21, 2020","By the time it's done, you might not know what the hell's gone on, but it is exciting nevertheless. It is ferociously entertaining.",fresh
Casey Chong,"Aug 21, 2020","For all the technical achievements and Christopher Nolan's potentially captivating time-inversion concept, ""Tenet"" lacks the heart and soul to qualify as among the best movies in his illustrious filmography.",rotten
Ian Sandwell,"Aug 21, 2020","An original and mind-bending take on a spy movie... Solely in terms of technical aspects, it's an incredible feat of filmmaking.",fresh
Jason Gorber,"Aug 21, 2020","Say what you will about the tenets of TENET, at least it has an ethos.",fresh
